{"schema_name":"resource-admission-configuration","schema_version":"1.0.0","kernel_version":"2.0.0","configuration_id":"resource-admission-default-v1","configuration_version":1,"bypass_threshold":8,"resources":[{"resource_class":"bilibili_download","capacity":1},{"resource_class":"youtube_download","capacity":1},{"resource_class":"whisper","capacity":1},{"resource_class":"codex_semantic","capacity":2},{"resource_class":"latex","capacity":1},{"resource_class":"pdf_render","capacity":1},{"resource_class":"visual_acceptance","capacity":1}]}
